brewery,city_state
"RAM Restaurant & Brewery, Indianapolis","Indianapolis, IN"
"Glacier Brewhouse, Anchorage","Anchorage, AK"
"Florida Beer Co., Melbourne","Melbourne, FL"
"Oggi's Pizza and Brewing, San Clemente","San Clemente, CA"
"BridgePort Brewing, Portland","Portland, OR"
"Diamond Bear Brewing Co., Little Rock","Little Rock, AR"
"Moose’s Tooth Brewing Co., Anchorage","Anchorage, AK"
"Western Reserve Brewing, Cleveland","Cleveland, OH"
"Two Rows Restaurant & Brewery, Dallas","Dallas, TX"
"Pug Ryans Brewery, Dillon","Dillon, CO"
"Hangar 24 Craft Brewery, Redlands","Redlands, CA"
"Pabst Brewing, Los Angeles","Los Angeles, CA"
"Emmett’s Tavern & Brewing Co., West Dundee","West Dundee, IL"
"Laurelwood Brewing, Portland","Portland, OR"
"Gella's Diner, Hays","Hays, KS"
"Flying Fish Brewing Co., Somerdale","Somerdale, NJ"
"Stewart’s Brewing Co., Bear","Bear, DE"
"Papago Brewing Co., Scottsdale","Scottsdale, AZ"
"Fat Head’s Brewery, North Olmsted","North Olmsted, OH"
"The Public House Brewing Co., Rolla","Rolla, MO"
"Gunnison Brewery, Gunnison","Gunnison, CO"
"Olde Saratoga Brewing Co., Saratoga Springs","Saratoga Springs, NY"
"Basil T’s Brewery & Italian Grill, Red Bank","Red Bank, NJ"
"Walnut Brewery, Louisville","Louisville, CO"
"Calhoun's Restaurant, Harrisonburg","Harrisonburg, VA"
"Big Time Brewery, Seattle","Seattle, WA"
"BJ's Restaurant & Brewery, Huntington Beach","Huntington Beach, CA"
"Renegade Brewing Co., Denver","Denver, CO"
"Spoetzl Brewery, Shiner","Shiner, TX"
"Chelsea Brewing, New York","New York, NY"
"Knee Deep Brewing Co., Lincoln","Lincoln, CA"
"Lost Coast Brewery, Eureka","Eureka, CA"
"Iron Hill Brewery, Phoenixville","Phoenixville, PA"
"Full Sail Brewing, Hood River","Hood River, OR"
"Bonfire Brewing, Eagle","Eagle, CO"
"Six Rivers Brewery, McKinleyville","McKinleyville, CA"
"Central Waters Brewing Co., Amherst","Amherst, WI"
"Arch Rock Brewing Co., Gold Beach","Gold Beach, OR"
"Two Beers Brewing Co., Seattle","Seattle, WA"
"Social Kitchen & Brewery, San Francisco","San Francisco, CA"
"Spellbound Brewing, Mount Holly","Mount Holly, NJ"
"Tied House Cafe, Mountain View","Mountain View, CA"
"RAM International/Humperdink's/Big Horn Brewing Co., Lakewood","Lakewood, WA"
"Great Northern Brewing, Whitefi sh","Whitefi sh, MT"
"Flossmoor Station, Flossmoor","Flossmoor, IL"
"Fat Head’s Brewery, Middleburg Heights","Middleburg Heights, OH"
"E.J. Phair Brewing Co., Concord","Concord, CA"
"Christian Moerlein Brewing Co., Cincinnati","Cincinnati, OH"
"The Sand, LotDenver","LotDenver, CO"
"Mayflower Brewing Co., Plymouth","Plymouth, MA"
"Ahnapee Brewery, Algoma","Algoma, WI"
"High Falls Brewing, Rochester","Rochester, NY"
"Rainier Brewing, Tumwater","Tumwater, WA"
"Del Norte Brewing Co., Denver","Denver, CO"
"CB & Potts Restaurant & Brewery, Fort CollinsFort Collins","Fort CollinsFort Collins, CO"
"Stroh Brewery, Fogelsville","Fogelsville, PA"
"Noble Ale Works, Anaheim","Anaheim, CA"
"Pete's Brewing, San Antonio","San Antonio, TX"
"Island Brewing, Carpinteria","Carpinteria, CA"
"Thirsty Dog Brewing, Canton","Canton, OH"
"Rockyard Brewing Co., Castle Rock","Castle Rock, CO"
"Summit Brewing, St Paul","St Paul, MN"
"The Cambridge House, Granby","Granby, CT"
"Karl Strauss Brewing, San Diego","San Diego, CA"
"Great Basin Brewing, Sparks","Sparks, NV"
"Glenwood Canyon Brewing, Glenwood Springs","Glenwood Springs, CO"
"Free State Brewing Co., Lawrence","Lawrence, KS"
"Boscos Brewing, Memphis/Nashville","Memphis/Nashville, TN"
"Schaefer Brewing, San Antonio","San Antonio, TX"
"Alvarado Street Brewery & Grill, Monterey","Monterey, CA"
"Old Dominion Brewing, Dover","Dover, DE"
"Gordon Biersch Brewery, Annapolis","Annapolis, MD"
"Michigan Brewing, Webberville","Webberville, MI"
"Snake River Brewing, Lander","Lander, WY"
"Brew Moon, Brookline","Brookline, MA"
"903 Brewers, Sherman","Sherman, TX"
"Rock Bottom, Englewood","Englewood, CO"
"Redrock Brewery, Salt Lake City","Salt Lake City, UT"
"Redhook Ale Brewery, Portland","Portland, OR"
"Columbia River Brewing Co., Portland","Portland, OR"
"Elevator Brewing, Columbus","Columbus, OH"
"Brooklyn Brewery, Brooklyn","Brooklyn, NY"
"BJ's Restaurant & Brewery, Boulder","Boulder, CO"
"Chama River Brewing, Albuquerque","Albuquerque, NM"
"Oggi's Pizza and Brewing, San Diego","San Diego, CA"
"Smiling Moose Brewpub & Grill, Greeley","Greeley, CO"
"Karbach Brewing Co., Houston","Houston, TX"
"Third Street Ale Works, Santa Rosa","Santa Rosa, CA"
"Ghostfish Brewing Co., Seattle","Seattle, WA"
"Atlanta Brewing Co., Atlanta","Atlanta, GA"
"RAM Restaurant & Brewery, Salem","Salem, OR"
"13 Virtues Brewing Co., Portland","Portland, OR"
"Ortlieb's Brewery & Grille, Pottstown","Pottstown, PA"
"AC Golden, Golden","Golden, CO"
"Silver City Brewery, Bremerton","Bremerton, WA"
"Jurupa Valley Brewing Co., Riverside","Riverside, CA"
"Pelican Pub, Pacifi c City","Pacifi c City, OR"
"Deschutes Brewery, Bend","Bend, OR"
"Hoppers Brooker Creek Grille and Tap Room, Palm Harbor","Palm Harbor, FL"
"Armadillo Ale Works, Denton","Denton, TX"
"Wicked Weed Brewing, Asheville","Asheville, NC"
"Fat Head’s Brewery - Portland, Portland","Portland, OR"
"Temperance Beer Co., Evanston","Evanston, IL"
"Minnesota Brewing, St. Paul","St. Paul, MN"
"J.T. Whitney's Pub & Brewery, Madison","Madison, WI"
"Bluegrass Brewing Co., Louisville","Louisville, KY"
"St. Ides Brewing, Milwaukee","Milwaukee, WI"
"Sweetwater Brewing, Atlanta","Atlanta, GA"
"Iron Hill Brewery, MediaMedia","MediaMedia, PA"
"Chicago Brewing, Las Vegas","Las Vegas, NV"
"Taps Fish House and Brewery, Brea","Brea, CA"
"High Sierra Brewing Co., Carson City","Carson City, NV"
"Rock Bottom, West Des Moines","West Des Moines, IA"
"Ei8ht Ball Brewing, Newport","Newport, KY"
"RAM Restaurant & Brewery, Tacoma","Tacoma, WA"
"McCoy's Public House, Kansas City","Kansas City, MO"
"Flat Tail Brewing Co., Corvallis","Corvallis, OR"
"SandLot, Denver","Denver, CO"
"10 Barrel Brewing Co., Bend","Bend, OR"
"Hops Grillhouse and Brewery, Madison","Madison, GA"
"Rock Bottom, Bethesda","Bethesda, MD"
"The SandLot, Denver","Denver, CO"
"St. Ides Brewing, San Antonio","San Antonio, TX"
"Taxman Brewing Co., Bargersville","Bargersville, IN"
"Rabbit Hole Brewing, Justin","Justin, TX"
"The Lion Brewery, Wilkes-Barre","Wilkes-Barre, PA"
"MobCraft Beer, Madison","Madison, WI"
"Tröegs Brewing Co., Hershey","Hershey, PA"
"Flying Dog Brewery, Frederick","Frederick, MD"
"Buzzards Bay Brewing, Westport","Westport, MA"
"BJ's Restaurant & Brewery, Roseville/Portland/Huntington Beach","Roseville/Portland/Huntington Beach, CA/OR/CA"
"Founders Brewing Co., Grand Rapids","Grand Rapids, MI"
"Broken Tooth Brewing, Anchorage","Anchorage, AK"
"Fort Point Beer Co., San Francisco","San Francisco, CA"
"McCoys Public House, Kansas City","Kansas City, MO"
"Terrapin Beer, Athens","Athens, GA"
"Brewer’s Alley Restaurant and Brewery, Frederick","Frederick, MD"
"Summit Brewing, Saint Paul","Saint Paul, MN"
"Überbrew, Billings","Billings, MT"
"General Lafayette Inn & Brewery, Lafayette Hill","Lafayette Hill, PA"
"Oaken Barrel Brewing Co., Greenwood","Greenwood, IN"
"Garage Brewing Co. & Pizzeria, Temecula","Temecula, CA"
"Green Flash Brewing Co., Vista","Vista, CA"
"Southampton Publick House, Southampton","Southampton, NY"
"Triumph Brewing, Princeton","Princeton, NJ"
"The Post Brewing Co., Lafayette","Lafayette, CO"
"Liquid Mechanics Brewing Co., Lafayette","Lafayette, CO"
"CODA Brewing Co., Aurora","Aurora, CO"
"Abita Brewing Co., Abita Springs","Abita Springs, LA"
"Benchmark Brewing Co., San Diego","San Diego, CA"
"Flat Branch Pub and Brewery, Columbia","Columbia, MO"
"New Helvetia Brewing Co., Sacramento","Sacramento, CA"
"Devils Backbone Brewing, BasecampRoseland","BasecampRoseland, VA"
"Shmaltz Brewing Co., San Francisco","San Francisco, CA"
"Haymarket Pub & Brewery, Chicago","Chicago, IL"
"Prison City Brewing, Auburn","Auburn, NY"
"DESTIHL, Normal","Normal, IL"
"Fonta Flora Brewery, Morganton","Morganton, NC"
"Pyramid Ales & Lagers, Seattle","Seattle, WA"
"Iron Hill Brewery, Philadelphia","Philadelphia, PA"
"Twin Peaks Brewery, Irving","Irving, TX"
"Sand, LotDenver","LotDenver, CO"
"Lone Star Brewing, San Antonio","San Antonio, TX"
"Kane Brewing Co., Ocean","Ocean, NJ"
"CooperSmith’s Pub & Brewing Co., Fort Collins","Fort Collins, CO"
"Neshaminy Creek Brewing, Croydon","Croydon, PA"
"Trap Rock Restaurant and Brewery, Berkeley Heights","Berkeley Heights, NJ"
"Sixpoint Craft Ales, Brooklyn","Brooklyn, NY"
"C.H. Evans Brewing Company, Albany","Albany, NY"
"Olde Hickory Brewery, Hickory","Hickory, NC"
"Morgan Territory Brewing, Tracy","Tracy, CA"
"C.B. & Potts, Fort Collins","Fort Collins, CO"
"Port Brewing and The Lost Abbey, San Marcos","San Marcos, CA"
"Arizona Roadhouse and Brewery, Tempe","Tempe, AZ"
"Fitzpatrick's, Iowa City","Iowa City, IA"
"North Coast Brewing, Fort Bragg","Fort Bragg, CA"
"Ybor City Brewing Company, Tampa","Tampa, FL"
"Alaskan Brewing, Juneau","Juneau, AK"
"5280 Roadhouse Brewery, Littleton","Littleton, CO"
"Cascade Brewery, Portland","Portland, OR"
"Oasis Texas Brewing Co., Austin","Austin, TX"
"The Grumpy Troll Restaurant & Brewery, Mount Horeb","Mount Horeb, WI"
"Rock Bottom, Denver","Denver, CO"
"RAM Restaurant & Brewery, IllinoisWheeling","IllinoisWheeling, IL"
"Ithaca Beer Co., Ithaca","Ithaca, NY"
"Two Brothers Brewing Co., Warrenville","Warrenville, IL"
"Union Colony Brewery, Greeley","Greeley, CO"
"Wiseacre Brewing Co., Memphis","Memphis, TN"
"Triumph Brewing, New Hope","New Hope, PA"
"Dale Bros. Brewery, Upland","Upland, CA"
"Fat Heads Brewery, North Olmsted","North Olmsted, OH"
"Russian River Brewing, Santa Rosa","Santa Rosa, CA"
"College Street Brewhouse & Pub, Lake Havasu City","Lake Havasu City, AZ"
"Devils Backbone Brewing, Lexington","Lexington, VA"
"Angelic Brewing, Madison","Madison, WI"
"St. Ides Brewing, Fogelsville","Fogelsville, PA"
"AC Golden Brewing Co., Golden","Golden, CO"
"Kona Brewing, Kailua-Kona","Kailua-Kona, HI"
"Lucky Envelope Brewing, Seattle","Seattle, WA"
"Devil’s Backbone Brewing Co., Roseland","Roseland, VA"
"The Bellows Brew Crew, Watertown","Watertown, WI"
"Brew Moon, Boston","Boston, MA"
"23rd Street Brewery, Lawrence","Lawrence, KS"
"BNS Brewing & Distilling Co., Santee","Santee, CA"
"Lewis & Clark Brewing Co., Helena","Helena, MT"
"Smartmouth Brewing Co., Norfolk","Norfolk, VA"
"Pig’s Eye Brewing Co., St. Paul","St. Paul, MN"
"Quincy Ships Brewing Company, Quincy","Quincy, MA"
"Rock Bottom, Westminster","Westminster, CO"
"Heavy Seas Beer, Baltimore","Baltimore, MD"
"Gigantic Brewing Co., Portland","Portland, OR"
"RAM Restaurant, Boise","Boise, ID"
"Port City Brewing Co., Alexandria","Alexandria, VA"
"G. Heileman Brewing, Fogelsville","Fogelsville, PA"
"Thirsty Dog Brewing, Independence","Independence, OH"
"Jester King Brewery, Austin","Austin, TX"
"Pelican Pub, Pacific City","Pacific City, OR"
"Elk Mountain Brewing Co., Parker","Parker, CO"
"Perennial Artisan Ales, Saint Louis","Saint Louis, MO"
"Boston Beer Co., Cincinnati","Cincinnati, OH"
"Moose's Tooth, Anchorage","Anchorage, AK"
"Tequesta Brewing Co., Tequesta","Tequesta, FL"
"Eel River Brewing, Fortuna","Fortuna, CA"
"Duck-Rabbit Craft Brewery, Farmville","Farmville, NC"
"Dells Brewing Co., Wisconsin Dells","Wisconsin Dells, WI"
"Red Eye Brewing Co., Wausau","Wausau, WI"
"Olde Peninsula Brewpub & Restaurant, Kalamazoo","Kalamazoo, MI"
"Dogfish Head Brewery, Rehoboth Beach","Rehoboth Beach, DE"
"Big Dog’s Brewing Co., Las Vegas","Las Vegas, NV"
"Oceanside Ale Works, Oceanside","Oceanside, CA"
"Leinenkugel Brewing, Chippewa Falls","Chippewa Falls, WI"
"Union Craft Brewing, Baltimore","Baltimore, MD"
"Rockford Brewing Co. - Rockford, Rockford","Rockford, MI"
"Heroes Restaurant and Brewery, Riverside","Riverside, CA"
"Bristol Brewing, Colorado Springs","Colorado Springs, CO"
"Otter Creek Brewing, Middlebury","Middlebury, VT"
"Three Magnets Brewing, Olympia","Olympia, WA"
"BJ's Grill & Brewery, Portland","Portland, OR"
"The Spoetzl Brewery, San Antonio","San Antonio, TX"
", ",", "
"Far West Ireland Brewing Co., Redmond","Redmond, WA"
"Fegley’s Allentown & Bethlehem Brew Works, Allentown","Allentown, PA"
"Anderson Valley Brewing, Booneville","Booneville, CA"
"Fox River Brewing, Oshkosh","Oshkosh, WI"
"Samuel Adams Brewing, Cincinnati","Cincinnati, OH"
"Desert Edge Brewery, Salt Lake City","Salt Lake City, UT"
"21st Amendment, San Francisco","San Francisco, CA"
"Listermann/Triple Digit Brewing Co., Cincinnati","Cincinnati, OH"
"Engine House #9 Restaurant & Brewery, Tacoma","Tacoma, WA"
"Dillon Dam Brewery, Dillon","Dillon, CO"
"Watch City Brewing Company, Waltham","Waltham, MA"
"Thirsty Dog Brewing, N. Canton","N. Canton, OH"
"Schlitz Brewing, Fogelsville","Fogelsville, PA"
"Firestone Walker, Paso Robles","Paso Robles, CA"
"Funkwerks, Fort Collins","Fort Collins, CO"
"75th Street Brewery, Lawrence","Lawrence, KS"
"Herkimer Pub and Brewery, Minneapolis","Minneapolis, MN"
"Barley's Casino, Henderson","Henderson, NV"
"Baxter Brewing Co., Auburn","Auburn, ME"
"Cambridge Brewing, Cambridge","Cambridge, MA"
"The Duck-Rabbit Craft Brewery, Farmville","Farmville, NC"
"America's Brewing Company, Aurora","Aurora, IL"
"Seabright Brewery, Santa Cruz","Santa Cruz, CA"
"Durango Brewing Co., Durango","Durango, CO"
"Michelob Brewing Co., St. Louis","St. Louis, MO"
"Iron Springs Pub & Brewery, Fairfax","Fairfax, CA"
"Rogue Ales, Newport","Newport, OR"
"Steel Toe Brewing, St. Louis Park","St. Louis Park, MN"
"Founders Restaurant & Brewing Company, Alexandria","Alexandria, VA"
"Smoky Mountain Brewery, Knoxville","Knoxville, TN"
"Big Rock Chop House, Birmingham","Birmingham, MI"
"Trinity Brewing, Providence","Providence, RI"
"Caldera Brewing Co., Ashland","Ashland, OR"
"Baker City Brewing Co., Baker City","Baker City, OR"
"Tustin Brewing Co., Tustin","Tustin, CA"
"Grimm Artisanal Ales, Brooklyn","Brooklyn, NY"
"Cisco Brewers, Nantucket","Nantucket, MA"
"Northwoods Brewing Corp., Eau Claire","Eau Claire, WI"
"Coors Archive Brewery, Golden","Golden, CO"
"On Tap Bistro & Brewery, San Diego","San Diego, CA"
"The Prodigal Brewery, Effingham","Effingham, NH"
"Moylan's Brewery, Novato","Novato, CA"
"Rock Bottom, La Jolla","La Jolla, CA"
"Santa Fe Brewing Co., Santa Fe","Santa Fe, NM"
"Boscos, Memphis","Memphis, TN"
"Trinity Brewing, Colorado Springs","Colorado Springs, CO"
"Champion Brewing Co., Charlottesville","Charlottesville, VA"
"Black Tooth Brewing Co., Sheridan","Sheridan, WY"
"Stone Brewing, San Diego","San Diego, CA"
"Eddyline Brewing, Buena Vista","Buena Vista, CO"
"American Brewing Co., Edmonds","Edmonds, WA"
"Epic Brewing Co., Salt Lake City","Salt Lake City, UT"
"Devils Backbone Brewing, OutpostLexington","OutpostLexington, VA"
"Craftsman Brewing Co., Pasadena","Pasadena, CA"
"Pennsylvania Brewing, Pittsburgh","Pittsburgh, PA"
"MillerCoors, Milwaukee","Milwaukee, WI"
"Fish Brewing Co., Olympia","Olympia, WA"
"Cigar City Brewing, Tampa","Tampa, FL"
"Maui Brewing, Maui","Maui, HI"
"Montana Brewing, Billings","Billings, MT"
"Burnside Brewing Co., Portland","Portland, OR"
"Breakside Brewery, Portland","Portland, OR"
"Blue Moon Brewing Co., Denver","Denver, CO"
"Magnolia Gastropub, San Francisco","San Francisco, CA"
"Etna Brewing Co., Etna","Etna, CA"
"Pabst Brewing, Woodridge","Woodridge, IL"
"Dale Bros Brewery, Upland","Upland, CA"
"Devils Backbone Brewing, Roseland","Roseland, VA"
"Fifty, Fifty Brewing Co.Truckee","Fifty Brewing Co.Truckee, CA"
"TAPS Fish House & Brewery, Corona","Corona, CA"
"Wilmington Brewing Company, Wilmington","Wilmington, NC"
"Main Street Station, Las Vegas","Las Vegas, NV"
"Mickey Finn's Brewery, Libertyville","Libertyville, IL"
"Coors Brewing, Golden","Golden, CO"
"Rochester Mills Beer Co., Rochester","Rochester, MI"
"Revolution Brewing, Chicago","Chicago, IL"
"Samuel Adams Brewing, Boston","Boston, MA"
"Gilded Otter Brewing Co., New Paltz","New Paltz, NY"
"Dark Horse Brewing Co., Marshall","Marshall, MI"
"Emmett's Tavern, West Dundee","West Dundee, IL"
"Right Brain Brewery, Traverse City","Traverse City, MI"
"Barley Island Brewing Co., Fishers","Fishers, IN"
"Clipper City Brewing, Baltimore","Baltimore, MD"
"The Detroit Beer Co., Detroit","Detroit, MI"
"Three Notch’d Brewing Co., Charlottesville","Charlottesville, VA"
"Oak Creek Brewing Co., Sedona","Sedona, AZ"
"Full Sail Brewing, Portland","Portland, OR"
"Bison Brewing Co., Berkeley","Berkeley, CA"
"Ghost River Brewing, Memphis","Memphis, TN"
"Wolf Canyon Brewing Company, Santa Fe","Santa Fe, NM"
"Plank Road Brewery, Milwaukee","Milwaukee, WI"
"5 Rabbit Cerveceria, Chicago","Chicago, IL"
"KettleHouse Brewing Co., Missoula","Missoula, MT"
"High Water Brewing, Chico","Chico, CA"
"Station Casinos Breweries / Barley’s Casino & Brewing Company, Henderson","Henderson, NV"
"Arcadia Brewing Co., Kalamazoo","Kalamazoo, MI"
"The Brooklyn Brewery, Brookyln","Brookyln, NY"
"Humboldt Brewery, Arcata","Arcata, CA"
"Bitter End, Austin","Austin, TX"
"New Holland Brewing, Holland","Holland, MI"
"Hailstorm Brewing Co., Tinley Park","Tinley Park, IL"
"Bulldog Brewing Co., Fresno","Fresno, CA"
"Dry Dock Brewing, Aurora","Aurora, CO"
"Blue Pants Brewery, Madison","Madison, AL"
"Fort Collins Brewery, Fort Collins","Fort Collins, CO"
"The Mash House Restaurant & Brewing Company -, Fayetteville","Fayetteville, NC"
"New Belgium Brewing, Fort Collins","Fort Collins, CO"
"Monday Night Brewing, Atlanta","Atlanta, GA"
"Heretic Brewing Co., Pittsburg","Pittsburg, CA"
"Black Forest Brew Haus LLC., Farmingdale","Farmingdale, NY"
"Fire, House Grill & BrewerySunnyvale","House Grill & BrewerySunnyvale, CA"
"Altitude Chophouse and Brewery, Laramie","Laramie, WY"
"BJ's Pizza Grill & Brewery, Brea","Brea, CA"
"Bear Republic Brewing, Cloverdale","Cloverdale, CA"
"Faction Brewing Co., Alameda","Alameda, CA"
"Zipline Brewing Co., Lincoln","Lincoln, NE"
"Ballast Point Brewing, San Diego","San Diego, CA"
"Monkey Paw Brewing Co., San Diego","San Diego, CA"
"Powerhouse Brewing, Sebastopol","Sebastopol, CA"
"Alesmith Brewing Co., San Diego","San Diego, CA"
"Redwood Curtain Brewing Co., Arcata","Arcata, CA"
"Iron Hill Brewery, West Chester","West Chester, PA"
"Bull & Bush Brewery, Denver","Denver, CO"
"Ham's Restaurant & Brewhouse, Greenville","Greenville, NC"
"Rock Bottom, Louisville","Louisville, CO"
"DuClaw Brewing Co., Bel Air","Bel Air, MD"
"Gordon Biersch Brewery, Rockville/Broomfield","Rockville/Broomfield, MD/CO"
"Bell’s Brewery, Galesburg","Galesburg, MI"
"Marble Brewery, Albuquerque","Albuquerque, NM"
"Prescott Brewing, Prescott","Prescott, AZ"
"Nectar Ales, Paso Robles","Paso Robles, CA"
"Former Future Brewing Co., Denver","Denver, CO"
"Blue Corn Brewery, Santa Fe","Santa Fe, NM"
"Goose Island Beer Co., Chicago","Chicago, IL"
"Newport Beach Brewing, Newport Beach","Newport Beach, CA"
"Half Acre Beer Co., Chicago","Chicago, IL"
"Rohrbach Brewing Co., Rochester","Rochester, NY"
"Honolulu Brewing Company LLC, Honolulu","Honolulu, HI"
"Societe Brewing Co., San Diego","San Diego, CA"
"Rock Bottom, Campbell","Campbell, CA"
"Fegley’s Brew Works, Allentown","Allentown, PA"
"Valhalla Microbrewery, Pittsburgh","Pittsburgh, PA"
"The Austin Beer Garden Brewing Co., Austin","Austin, TX"
"Snipes Mountain Brewing, Sunnyside","Sunnyside, WA"
"Panther Island Brewing Co., Fort Worth","Fort Worth, TX"
"John Harvard's Brew House, Springfield","Springfield, PA"
"WeldWerks Brewing Co., Greeley","Greeley, CO"
"Mammoth Brewing, Mammoth","Mammoth, CA"
"Institution Ale Co., Camarillo","Camarillo, CA"
"Allentown/Bethlehem Brew Works, Allentown","Allentown, PA"
"Platt Park Brewing Co., Denver","Denver, CO"
"Lone Star Brewing, Milwaukee","Milwaukee, WI"
"Fargo Brewing Co., Fargo","Fargo, ND"
"Boise Brewing, Boise","Boise, ID"
"Rock Bottom, Chicago","Chicago, IL"
"Offshore Ale Company, Oak Bluffs","Oak Bluffs, MA"
"Starr Hill Brewing, Charlottesville","Charlottesville, VA"
"SLO Brewing, San Luis Obispo","San Luis Obispo, CA"
"Native Brewing Company, Alexandria","Alexandria, VA"
"Gella's Diner & Liquid Bread Brewing Co., Hays","Hays, KS"
"Mazama Brewing Co., Corvallis","Corvallis, OR"
"Alpine Beer, Alpine","Alpine, CA"
"Barley Brothers Brewery, Baker City","Baker City, OR"
"O’so Brewing, Plover","Plover, WI"
"RAM Restaurant, Seattle","Seattle, WA"
"Lawson’s Finest Liquids, Warren","Warren, VT"
"Wild Duck Brewery & Restaurant, Eugene","Eugene, OR"
"Far West Brewing Co., Redmond","Redmond, WA"
"5 Stones Artisan Brewery, Cibolo","Cibolo, TX"
"Saranac/F., X. Matt Brewing Co.Utica","X. Matt Brewing Co.Utica, NY"
"Carbondale Craft Beer, Carbondale","Carbondale, IL"
"Bootstrap Brewing Co., Niwot","Niwot, CO"
"Summit Brewing, St. Paul","St. Paul, MN"
"Empire Brewing Company of Syracuse, Syracuse","Syracuse, NY"
"The Oyster Bar Bistro & Brewery, Fort Wayne","Fort Wayne, IN"
"Marley’s Brewery & Grille, Bloomsburg","Bloomsburg, PA"
"Unique Beers, Orlando","Orlando, FL"
"Captain Lawrence Brewing, Pleasantville","Pleasantville, NY"
"Carolina Brewery, Chapel Hill","Chapel Hill, NC"
"Valley Brewing Co., Stockton","Stockton, CA"
"Fulton Beer, Minneapolis","Minneapolis, MN"
"Yellow Springs Brewery, Yellow Springs","Yellow Springs, OH"
"Fremont Brewing Co., Seattle","Seattle, WA"
"Canteen Brewhouse, Albuquerque","Albuquerque, NM"
"The Brew Kettle, Strongsville","Strongsville, OH"
"Bastone Brewery, Royal Oak","Royal Oak, MI"
"DOG Brewing Co., Westminster","Westminster, MD"
"Babe’s Bar-B-Que & Brewhouse, Rancho Mirage","Rancho Mirage, CA"
"Grand Teton Brewing, Victor","Victor, ID"
"Ritual Brewing Co., Redlands","Redlands, CA"
"49th State Brewing Co., Denali National Park","Denali National Park, AK"
"Bend Brewing, Bend","Bend, OR"
"Bier Brewery, Indianapolis","Indianapolis, IN"
"Boulevard Brewing, Kansas City","Kansas City, MO"
"Black Diamond Brewing Co., Concord","Concord, CA"
"Pumphouse Brewery, Longmont","Longmont, CO"
"Port Brewing Co., San Marcos","San Marcos, CA"
"Anheuser-Busch, Fort Collins","Fort Collins, CO"
"Schlitz Brewing, San Antonio","San Antonio, TX"
"Carter’s Brewing, Billings","Billings, MT"
"SandLot Brewery at Coors Field, Denver","Denver, CO"
"Jos. Schlitz Brewing Company, Fogelsville","Fogelsville, PA"
"Casco Bay Brewing Company, Portland","Portland, ME"
"Pagosa Brewing, Pagosa Springs","Pagosa Springs, CO"
"CB & Potts Restaurant & Brewery, Highlands Ranch","Highlands Ranch, CO"
"Outer Banks Brewing Co., Kill Devil Hills","Kill Devil Hills, NC"
"Fitger’s Brewhouse, Duluth","Duluth, MN"
"75th Street Brewery, Kansas City","Kansas City, MO"
"The Rare Barrel, Berkeley","Berkeley, CA"
"Santa Barbara Brewing, Santa Barbara","Santa Barbara, CA"
"Rock Bottom, Braintree","Braintree, MA"
"Real Ale Brewing Co., Blanco","Blanco, TX"
"Starr Hill Brewing, Crozet","Crozet, VA"
"Columbus Brewing Co., Columbus","Columbus, OH"
"Wit’s End Brewing Co., Denver","Denver, CO"
"Nebraska Brewing Co., Papillion","Papillion, NE"
"Airways Brewing Co., Kent","Kent, WA"
"Holy City Brewing, North Charleston","North Charleston, SC"
"Russian River Brewing, Guerneville","Guerneville, CA"
"Hoppy Brewing, Sacramento","Sacramento, CA"
"Badger Hill Brewing, St. Louis Park","St. Louis Park, MN"
"Four Peaks Brewing, Tempe","Tempe, AZ"
"Dogfish Head Brewery, Milton","Milton, DE"
"Haverhill Brewery, Haverhill","Haverhill, MA"
"Aftershock Brewing Co., Temecula","Temecula, CA"
"Joseph James Brewing Co., Henderson","Henderson, NV"
"BJ's Restaurant & Brewery, Reno/Chandler/Huntington Beach","Reno/Chandler/Huntington Beach, NV/AZ/CA"
"Figueroa Mountain Brewing, Buellton","Buellton, CA"
"Holy City Brewing, Charleston","Charleston, SC"
"Stroh Brewery, San Antonio","San Antonio, TX"
"Uncle Billy’s Brew & Que, Austin","Austin, TX"
"Tenaya Creek Brewery, Las Vegas","Las Vegas, NV"
"Iron Hill Brewery, Lancaster","Lancaster, PA"
"Smylie Brothers Brewing Co., Evanston","Evanston, IL"
"Pizza Port, Ocean Beach","Ocean Beach, CA"
"Pug Ryan's Brewery, Dillon","Dillon, CO"
"Ground Breaker Brewing, Portland","Portland, OR"
"Colorado Boy Brewing Co., Ridgway","Ridgway, CO"
"Hale's Ales, Seattle","Seattle, WA"
"Dillon DAM Brewery, Dillon","Dillon, CO"
"Aardwolf Brewing Co., Jacksonville","Jacksonville, FL"
"Breckenridge Brewery, Denver","Denver, CO"
"Peticolas Brewing Co., Dallas","Dallas, TX"
"Squatters, Salt Lake City","Salt Lake City, UT"
"Blue Corn Brewery, Albuquerque","Albuquerque, NM"
"SweetWater Brewing Co., Atlanta","Atlanta, GA"
"Great South Bay Brewery, Bay Shore","Bay Shore, NY"
"Denver Beer Company, Denver","Denver, CO"
"Sly Fox Brewhouse, Phoenixville","Phoenixville, PA"
"Oskar Blues, Longmont","Longmont, CO"
"Weasel Boy Brewing Co., Zanesville","Zanesville, OH"
"Bullfrog Brewery, Williamsport","Williamsport, PA"
"Park Slope Brewing Company, Brooklyn","Brooklyn, NY"
"Max Lager’s Wood-Fired Grill & Brewery, Atlanta","Atlanta, GA"
"Nodding Head Brewing, Philadelphia","Philadelphia, PA"
"Kootenai River Brewing Co., Bonners Ferry","Bonners Ferry, ID"
"Brugge Brasserie, Indianapolis","Indianapolis, IN"
"RAM Restaurant & Brewery, SeattleSeattle","SeattleSeattle, WA"
"Boscos Brewing, Memphis","Memphis, TN"
"Blackberry Farm Brewery, Walland","Walland, TN"
"Elk Grove Brewery, Elk Grove","Elk Grove, CA"
"Hoppin’ Frog Brewing Co., Akron","Akron, OH"
"Austin Beerworks, Austin","Austin, TX"
"Bohemian Brewery, Midvale","Midvale, UT"
"HofbrauHaus Brewery and Biergarten at Station Casino, Kansas City","Kansas City, MO"
"Rock Bottom, Phoenix","Phoenix, AZ"
"Huss Brewing, Tempe","Tempe, AZ"
