brewery,city_state
"Golden Valley Brewery and Pub, McMinnville","McMinnville, OR"
"Diebolt Brewing Co., Denver","Denver, CO"
"Thai Me Up Brewery, Jackson","Jackson, WY"
"Devils Backbone Brewing, Outpost","Outpost, "
"Short’s Brewing Co., Elk Rapids","Elk Rapids, MI"
"Telluride Brewing Co., Telluride","Telluride, CO"
"Alameda Brewhouse, Portland","Portland, OR"
"Pizza Port, San Diego","San Diego, CA"
"Jarre Creek Ranch Brewery, Castle Rock","Castle Rock, CO"
"Stoudt's Brewing, Adamstown","Adamstown, PA"
"BJ's Restaurant & Brewery, Jantzen Beach/Lloyd Center/Clear Lake","Jantzen Beach/Lloyd Center/Clear Lake, OR/OR/TX"
"Odell Brewing, Fort Collins","Fort Collins, CO"
"Big Horn Brewing, Tacoma","Tacoma, WA"
"New River Brewing, Blacksburg","Blacksburg, VA"
"Thr3e Wise Men Brewing Co., Indianapolis","Indianapolis, IN"
"Rock Bottom, Seattle","Seattle, WA"
"The Lost Abbey, San Marcos","San Marcos, CA"
"Brothers Craft Brewing, Harrisonburg","Harrisonburg, VA"
"Rock Bottom, Arlington","Arlington, VA"
"Custom Brew Crafters, Honeoye Falls","Honeoye Falls, NY"
"Main Street Brewery, Corona","Corona, CA"
"Big Horn Brewing, Addison","Addison, TX"
"Eugene City Brewery, Eugene","Eugene, OR"
"Stormcloud Brewing Co., Frankfort","Frankfort, MI"
"BJ's Restaurant & Brewery, ChandlerChandler","ChandlerChandler, AZ"
"Dogwood Brewing Co., Atlanta","Atlanta, GA"
"Big Horn Brewing, Lakewood","Lakewood, WA"
"Rio Salado Brewing Company, Tempe","Tempe, Arizona"
"Black Project Spontaneous & Wild Ales, Denver","Denver, CO"
"Mountain Sun Pub, Boulder","Boulder, CO"
"Wind River Brewing Co., Pinedale","Pinedale, WY"
"Kern River Brewing, Kernville","Kernville, CA"
"The Covey Restaurant & Brewery, Fort Worth","Fort Worth, TX"
"Moon River Brewing Co., Savannah","Savannah, GA"
"Hopworks Urban Brewery, Portland","Portland, OR"
"Pearl Brewing Co., Fort Worth","Fort Worth, TX"
"Steelhead Brewery, Eugene","Eugene, OR"
"Il Vicino Brewing, Albuquerque","Albuquerque, NM"
"Bagby Beer Co., Oceanside","Oceanside, CA"
"Smog City Brewing, Torrance","Torrance, CA"
"Lakefront Brewery, Milwaukee","Milwaukee, WI"
"Rogue Ales, Portland","Portland, OR"
"Glenwood Canyon Brewing, Glenwood","Glenwood, CO"
"Castle Springs Brewing, Moultonborough","Moultonborough, NH"
"River’s Edge Brewing Co., Milford","Milford, MI"
"RAM Restaurant, Schaumburg","Schaumburg, IL"
"Smugglers Brewpub, Telluride","Telluride, CO"
"Redhook Ale Brewery, Woodinville","Woodinville, WA"
"Uinta Brewing, Salt Lake City","Salt Lake City, UT"
"John Harvard's Brew House, Wayne","Wayne, PA"
"Old Town Brewing, Portland","Portland, OR"
"Flyers Restaurant and Brewery, Oak Harbor","Oak Harbor, WA"
"Horse Thief Hollow, Chicago","Chicago, IL"
"New River Brewing, Atlanta","Atlanta, GA"
"Napa Smith Brewery, Napa","Napa, CA"
"Peekskill Brewery, Peekskill","Peekskill, NY"
"Central Waters Brewing Co., Junction City","Junction City, WI"
"C. H. Evans Brewing, Albany","Albany, NY"
"Telegraph Brewing Co., Santa Barbara","Santa Barbara, CA"
"Portland Brewing, Portland","Portland, OR"
"Iron Hill Brewery, Newark","Newark, DE"
"Steelhead Brewery, Burlingame","Burlingame, CA"
"Gibb’s Hundred Brewing Co., Greensboro","Greensboro, NC"
"Back Forty Beer Co., Gadsden","Gadsden, AL"
"Dogfi sh Head Craft Brewery, Milton","Milton, DE"
"Blitz-Weinhard Brewing, Tumwater","Tumwater, WA"
"Bosque Brewing Co., Albuquerque","Albuquerque, NM"
"Harvester Brewing, Portland","Portland, OR"
"von Trapp Brewing, Stowe","Stowe, VT"
"Wynkoop Brewing, Denver","Denver, CO"
"Saint Archer Brewing Co., San Diego","San Diego, CA"
"Fat Heads Brewery, Middleburg Heights","Middleburg Heights, OH"
"Strange Brewing Co., Denver","Denver, CO"
"Left Hand Brewing Co., Longmont","Longmont, CO"
"Holy Cow! Casino Café & Brewery, Las Vegas","Las Vegas, NV"
"Snow Goose Restaurant and Sleeping Lady Brewing Company, Anchorage","Anchorage, AK"
"Oasis Brewery, Boulder","Boulder, CO"
"Salem Beer Works, Salem","Salem, MA"
"Blue Moon Brewing Co., Golden","Golden, CO"
"BJ's Restaurant & Brewery, Woodland Hills","Woodland Hills, CA"
"Melvin Brewing, Jackson","Jackson, WY"
"Stewart's Brewing Co., Bear","Bear, DE"
"Spanish Springs Brewing, The Villages","The Villages, FL"
"Kettlehouse Brewing Co., Missoula","Missoula, MT"
"The Bruery, Placentia","Placentia, CA"
"Fate Brewing Co., Scottsdale","Scottsdale, AZ"
"New English Brewing Co., San Diego","San Diego, CA"
"FiftyFifty Brewing Co., Truckee","Truckee, CA"
"RAM International/Big Horn Brewing, Lakewood","Lakewood, WA"
"Mammoth Brewing, Mammoth Lakes","Mammoth Lakes, CA"
"Triple Rock Brewery, Berkeley","Berkeley, CA"
"Beaver St. Brewery, Flagstaff","Flagstaff, AZ"
"Delafield Brewhaus, Delafield","Delafield, WI"
"Pinthouse Pizza, Austin","Austin, TX"
"Fat Head’s Brewery - N. Olmstead, North Olmsted","North Olmsted, OH"
"Redhook Ale Brewery, Portsmouth","Portsmouth, NH"
"Morgan Street Brewery, Saint Louis","Saint Louis, MO"
"Red Brick-Atlanta Brewing Co., Atlanta","Atlanta, GA"
"Drake's Brewing, San Leandro","San Leandro, CA"
"Twisted Pine Brewing Co., Boulder","Boulder, CO"
"Full Pint Brewing Co., North Versailles","North Versailles, PA"
"Crow Hop Brewing Co., Loveland","Loveland, CO"
"Diamondback Brewery, Cleveland","Cleveland, OH"
"BJ's Restaurant & Brewery, AZ/Boulder","AZ/Boulder, CO"
"RJ Rockers Brewing Co., Spartanburg","Spartanburg, SC"
"New Road Brew House, Collegeville","Collegeville, PA"
"Colorado Brewery & Trading Co., Danbury","Danbury, CT"
"Port Brewing & The Lost Abbey, San Marcos","San Marcos, CA"
"Brickstone Brewery, Bourbonnais","Bourbonnais, IL"
"Empire Brewing Co. of Rochester, Rochester","Rochester, NY"
"Colorado Brewing Co./Draft House, Boulder","Boulder, CO"
"Tapistry Brewing Co., Bridgman","Bridgman, MI"
"5 Rabbit Cerveceria, Bedford Park","Bedford Park, IL"
"Foothills Brewing, Winston-Salem","Winston-Salem, NC"
"Prost Brewing, Denver","Denver, CO"
"Sly Fox Brewhouse, Pottstown","Pottstown, PA"
"Big Horn Brewing, Indianapolis","Indianapolis, IN"
"New South Brewing, Myrtle Beach","Myrtle Beach, SC"
"El Toro Brewing Co., Morgan Hill","Morgan Hill, CA"
"RedRock Brewing Co., Salt Lake City","Salt Lake City, UT"
"Allagash Brewing Co., Portland","Portland, ME"
"South Park Brewing - CA, San Diego","San Diego, CA"
"Logsdon Organic Farm Brewery, Hood River","Hood River, OR"
"La Cumbre Brewing Co., Albuquerque","Albuquerque, NM"
"New Bohemia Brewing Co., Santa Cruz","Santa Cruz, CA"
"Humperdinks Big Horn Brewing, Dallas","Dallas, TX"
"Rocky River Brewing, Rocky River","Rocky River, OH"
"URBN St. Brewing Co., El Cajon","El Cajon, CA"
"Shine Brewing Co., Boulder","Boulder, CO"
"Stone Brewing, San Marcos","San Marcos, CA"
"MacTarnahan's Brewing, Portland","Portland, OR"
"Shorts Brewing Co., Bellaire","Bellaire, MI"
"Moab Brewery, Moab","Moab, UT"
"La Conner Brewing Company, La Conner","La Conner, WA"
"Schaefer Brewing, Fogelsville","Fogelsville, PA"
"Hoptown Brewing, Pleasanton","Pleasanton, CA"
"Thirsty Dog Brewing, Akron/Canton","Akron/Canton, OH"
"The Sandlot, Denver","Denver, CO"
"Lander Brewing Co., Lander","Lander, WY"
"Broadway Brewing, Denver","Denver, CO"
"The Bruery, Anaheim","Anaheim, CA"
"Humperdinks Big Horn Brewing, Lakewood","Lakewood, WA"
"Barren Hill Tavern and Brewery, Lafayette Hill","Lafayette Hill, PA"
"Utah Brewers, Salt Lake City","Salt Lake City, UT"
"TAPS Fish House & Brewery, Brea","Brea, CA"
"The Commons Brewery, Portland","Portland, OR"
"BRU Handbuilt Ales & Eats, Boulder","Boulder, CO"
"Track 7 Brewing Co. - Natomas, Sacramento","Sacramento, CA"
"Minneapolis Town Hall Brewery, Minneapolis","Minneapolis, MN"
"Stillmank Brewing Co., Green Bay","Green Bay, WI"
"Copper Kettle Brewing Co., Denver","Denver, CO"
"Rock Bottom, Bellevue","Bellevue, WA"
"Dock Street Brewery, Philadelphia","Philadelphia, PA"
"Midnight Sun Brewing Co., Anchorage","Anchorage, AK"
"Sierra Blanca Brewing Co., Moriarty","Moriarty, NM"
"Willoughby Brewing, Willoughby","Willoughby, OH"
"Portsmouth Brewery, Portsmouth","Portsmouth, NH"
"Amicas, Salida","Salida, CO"
"Trout Creek Brewing Company, Boulder","Boulder, CO"
"Mother Earth Brewing, Kinston","Kinston, NC"
"pFriem Family Brewers, Hood River","Hood River, OR"
"Pizza Port, Solana Beach","Solana Beach, CA"
"Beaver Street Brewery, Flagstaff","Flagstaff, AZ"
"Grapevine Craft Brewery, Grapevine","Grapevine, TX"
"The Alchemist, Waterbury","Waterbury, VT"
"City Star Brewing, Berthoud","Berthoud, CO"
"Maui Brewing, Lahaina","Lahaina, HI"
"Crooked River Brewing, Cleveland","Cleveland, OH"
"Lexington Avenue Brewery, Asheville","Asheville, NC"
"NoDa Brewing Co., Charlotte","Charlotte, NC"
"Steamworks Brewing, Durango/Bayfield","Durango/Bayfield, CO"
"Steelhead Brewery, Irvine","Irvine, CA"
"Great Basin Brewing, Reno","Reno, NV"
"Buoy Beer Co., Astoria","Astoria, OR"
"Upstream Brewing, Omaha","Omaha, NE"
"Anderson Valley Brewing, Boonville","Boonville, CA"
"Boxing Bear Brewing Co., Albuquerque","Albuquerque, NM"
"Sleeping Giant Brewing Company, Billings","Billings, MT"
"Sun King Brewery, Indianapolis","Indianapolis, IN"
"Cascade Lakes Brewing Co., Redmond","Redmond, OR"
"Brewery Ommegang, Cooperstown","Cooperstown, NY"
"Wolf Pack Brewing, West Yellowstone","West Yellowstone, MT"
"Brewzzi West Palm, West Palm Beach","West Palm Beach, FL"
"Michelob Brewing Co., Saint Louis","Saint Louis, MO"
"Stoudt Brewery, Adamstown","Adamstown, PA"
"Sockeye Brewing, Boise","Boise, ID"
"Yak & Yeti Restaurant & Brewpub, Arvada","Arvada, CO"
"CB & Pott’s Restaurant & Brewery (Highlands Ranch), Highlands Ranch","Highlands Ranch, CO"
"Highland Brewing Co., Asheville","Asheville, NC"
"Fair Winds Brewing Co., Lorton","Lorton, VA"
"Saucony Creek Brewing Co., Kutztown","Kutztown, PA"
"Bridge Port Brewing Company, Portland","Portland, OR"
"Dostal Alley BrewPub, Central City","Central City, CO"
"Pelican Brewing Co., Tillamook","Tillamook, OR"
"Newburgh Brewing Co., Newburgh","Newburgh, NY"
"Breakside Brewery, Milwaukie","Milwaukie, OR"
"Mission Brewery, San Diego","San Diego, CA"
"Red Rock Brewing, Salt Lake City","Salt Lake City, UT"
"Fat Head’s Brewery & Saloon, North Olmsted","North Olmsted, OH"
"Walnut Brewery, Boulder","Boulder, CO"
"Empire Brewery of Rochester, Rochester","Rochester, NY"
"The Beer Co., Detroit","Detroit, MI"
"Community Beer Co., Dallas","Dallas, TX"
"C.B. & Potts, Englewood","Englewood, CO"
"Otto Brothers Brewing Co., Victor","Victor, ID"
"Black Star Co-op, Austin","Austin, TX"
"Rock Bottom, Milwaukee","Milwaukee, WI"
"Hoppers Grill & Brewery, Midvale","Midvale, UT"
"Rogue Brewery, Newport","Newport, OR"
"Old Dominion Brewing, Ashburn","Ashburn, VA"
"Gordon Biersch Brewery, Broomfield","Broomfield, CO"
"Mad Fox Brewing Co., Falls Church","Falls Church, VA"
"Roadhouse Brewing Co., Jackson","Jackson, WY"
"Perennial Artisan Ales, St. Louis","St. Louis, MO"
"JAFB Wooster Brewery, Wooster","Wooster, OH"
"The Church Brew Works, Pittsburgh","Pittsburgh, PA"
"The Olde Mecklenburg Brewery, Charlotte","Charlotte, NC"
"Watson Brothers Brewhouse, Cincinnati","Cincinnati, OH"
"Mickey's Brewing, Milwaukee","Milwaukee, WI"
"Huntington Beach Beer Co., Huntington Beach","Huntington Beach, CA"
"Yazoo Brewing, Nashville","Nashville, TN"
"Rhinegeist Brewing, Cincinnati","Cincinnati, OH"
"Gun Hill Brewing Co., Bronx","Bronx, NY"
"Hereford & Hops Brewpub, Wausau","Wausau, WI"
"Buckbean Brewing Co., Reno","Reno, NV"
"New Glarus Brewing, New Glarus","New Glarus, WI"
"Great Northern Brewing, Whitefish","Whitefish, MT"
"Great American Restaurants, Centreville","Centreville, VA"
"Logsdon Farmhouse Ales, Hood River","Hood River, OR"
"Bear Republic Brewing, Healdsburg","Healdsburg, CA"
"Waterloo Brewing Company, Austin","Austin, TX"
"Mill Creek Brewpub, Walla Walla","Walla Walla, WA"
"Heartland Brewery, New York","New York, NY"
"Brewzzi, West Palm Beach","West Palm Beach, FL"
"Smuttynose Brewing, Portsmouth","Portsmouth, NH"
"Platform Beer Co., Cleveland","Cleveland, OH"
"TAPS Fish House & Brewery, BreaBrea","BreaBrea, CA"
"Port Brewing Pizza Port Carlsbad, Carlsbad","Carlsbad, CA"
"SKA Brewing, Durango","Durango, CO"
"Snake River Brewing, Jackson","Jackson, WY"
"North by Northwest, Austin","Austin, TX"
"Springfield Brewing, Springfield","Springfield, MO"
"Big Horn Brewing, Denver","Denver, CO"
"Detroit Beer Co., Detroit","Detroit, MI"
"Blitz-Weinhard Brewing, Hood River","Hood River, OR"
"Pale Fire Brewing Co., Harrisonburg","Harrisonburg, VA"
"Redwood Brewing, Flint","Flint, MI"
"Our Mutual Friend Malt & Brew, Denver","Denver, CO"
"Spanish Peaks Brewing, Stamford","Stamford, CT"
"Port Brewing Co. Pizza Port Carlsbad, Carlsbad","Carlsbad, CA"
"Montgomery Brewing Co., Montgomery","Montgomery, AL"
"Mad River Brewing Co., Blue Lake","Blue Lake, CA"
"Great Adirondack Brewing Co., Lake Placid","Lake Placid, NY"
"Propolis Brewing, Port Townsend","Port Townsend, WA"
"Pedernales Brewing Co., Fredericksburg","Fredericksburg, TX"
"Sports City Café & Brewery, La Jolla","La Jolla, CA"
"Stone Brewing, Escondido","Escondido, CA"
"Coda Brewing Co., Aurora","Aurora, CO"
"St. Florian’s Brewery, Windsor","Windsor, CA"
"Breakwater Brewing Co., Oceanside","Oceanside, CA"
"Back Street Brewery, Vista","Vista, CA"
"Natty Greene’s Brewing Co., Greensboro","Greensboro, NC"
"Walking Man Brewing, Stevenson","Stevenson, WA"
"Nebraska Brewing Co., La Vista","La Vista, NE"
"DESTIHL - Champaign, Champaign","Champaign, IL"
"Tahoe Mountain Brewing, Truckee","Truckee, CA"
"Sierra Nevada Brewing, Chico","Chico, CA"
"Wander Brewing, Bellingham","Bellingham, WA"
"21st Amendment, San Leandro","San Leandro, CA"
"Gordon Biersch Brewery, Chattanooga","Chattanooga, TN"
"Lickinghole Creek Craft Brewery, Goochland","Goochland, VA"
"Sullivan’s Black Forest Brew Haus & Grill, Frankenmuth","Frankenmuth, MI"
"Wagner Valley Brewing Co., Lodi","Lodi, NY"
"Boundary Bay Brewery, Bellingham","Bellingham, WA"
"Flying Fish Brewing Co., Cherry Hill","Cherry Hill, NJ"
"Weyerbacher Brewing Co., Easton","Easton, PA"
"Flix Brewhouse - Indy, Carmel","Carmel, IN"
"Rock Bottom, Long Beach","Long Beach, CA"
"Minocqua Brewing Company, Minocqua","Minocqua, WI"
"The Boston Beer Co., Boston","Boston, MA"
"Rahr & Sons Brewing, Fort Worth","Fort Worth, TX"
"Baltimore Brewing, Baltimore","Baltimore, MD"
"Karl Strauss Brewing, La Jolla","La Jolla, CA"
"Adelbert’s Brewery, Austin","Austin, TX"
"Charleville Vineyard & Microbrewery, Ste. Genevieve","Ste. Genevieve, MO"
"Exile Brewing, Des Moines","Des Moines, IA"
"Short’s Brewing Co., Bellaire","Bellaire, MI"
"Kalamazoo Brewing, Kalamazoo","Kalamazoo, MI"
"Colorado Belle, Laughlin","Laughlin, NV"
"Erie Brewing, Erie","Erie, PA"
"Lompoc Brewing - The 5th Quadrant, Portland","Portland, OR"
"(512) Brewing Co., Austin","Austin, TX"
"Flying Dog Brewery, Denver","Denver, CO"
"Pizza Port, San Clemente","San Clemente, CA"
"Alltech's Lexington Brewing Co., Lexington","Lexington, KY"
"Wynwood Brewing Co., Miami","Miami, FL"
"Commonwealth Brewing, Boston","Boston, MA"
"Tap It Brewing Co., San Luis Obispo","San Luis Obispo, CA"
"Spanish Peaks Brewing, King City","King City, CA"
"Tampa Bay Brewing Co., Tampa","Tampa, FL"
"Karl Strauss Brewing, Costa Mesa","Costa Mesa, CA"
"Yards Brewing Co., Philadelphia","Philadelphia, PA"
"Brewery Rickoli, Wheat Ridge","Wheat Ridge, CO"
"Long Valley Pub, Long Valley","Long Valley, NJ"
"The Royal Oak Brewery, Royal Oak","Royal Oak, MI"
"O'Fallon Brewery, O'Fallon","O'Fallon, MO"
"Piece Brewery, Chicago","Chicago, IL"
"Bethlehem Brew Works, Bethlehem","Bethlehem, PA"
"Iron Hill Brewery, LancasterLancaster","LancasterLancaster, PA"
"BJ's Restaurant & Brewery, Chandler","Chandler, AZ"
"Brewzzi, Boca Raton","Boca Raton, FL"
"Opa-Opa Brewing Co., Southampton","Southampton, MA"
"Mystic Brewery, Chelsea","Chelsea, MA"
"West O Beer, West Okoboji","West Okoboji, IA"
"Elliott Bay Brewing, Seattle","Seattle, WA"
"Bob's House of Brews, Grand Rapids","Grand Rapids, MI"
"Bottoms Up Brewing, Pinedale","Pinedale, WY"
"Copper Tank Brewing Co., Dallas","Dallas, TX"
"CB and Potts Restaurant and Brewery, Fort Collins","Fort Collins, "
"Coastal Empire Beer Co., Savannah","Savannah, GA"
"Hollister Brewing Co., Goleta","Goleta, CA"
"Ram Production Brewery, Tacoma","Tacoma, WA"
"Amherst Brewing, Amherst","Amherst, MA"
"Gordon Biersch Brewery, Rockville","Rockville, MD"
"Tommyknocker Brewery, Idaho Springs","Idaho Springs, CO"
"The Civil Life Brewing Co., St. Louis","St. Louis, MO"
"The Stroh Brewery Company, Fogelsville","Fogelsville, PA"
"Fitgers Brewhouse, Duluth","Duluth, MN"
"Spangalang Brewery, Denver","Denver, CO"
"Bemidji Brewing Co., Bemidji","Bemidji, MN"
"Three Floyds Brewing Co., Munster","Munster, IN"
"Capital Brewery, Middleton","Middleton, WI"
"New Planet Beer Co., Boulder","Boulder, CO"
"James Page Brewing, Minneapolis","Minneapolis, MN"
"Headlands Brewing Co., Mill Valley","Mill Valley, CA"
"C.B. Potts Restaurant & Brewery (Fort Collins), Fort Collins","Fort Collins, CO"
"Mispillion River Brewing, Milford","Milford, DE"
"Capitol City Brewing, Washington","Washington, DC"
"August Schell Brewing, New Ulm","New Ulm, MN"
"Hamm's Brewing Company, Milwaukee","Milwaukee, WI"
"Schooner’s Grille & Brewery, Antioch","Antioch, CA"
"Silver Moon Brewing, Bend","Bend, OR"
"Il Vicino Brewing, Colorado Springs","Colorado Springs, CO"
"John Harvard's Brew House, Framingham","Framingham, MA"
"Indeed Brewing Co., Minneapolis","Minneapolis, MN"
"J.J. Bitting Brewing Co., Woodbridge","Woodbridge, NJ"
"Blackstone Brewing, Nashville","Nashville, TN"
"Blind Tiger Brewery, Topeka","Topeka, KS"
"EarthBread + Brewery, Philadelphia","Philadelphia, PA"
"The Great Dane Pub, Madison","Madison, WI"
"Rock Bottom, Broomfield","Broomfield, CO"
"New Mexico Brewers Guild, Santa Fe","Santa Fe, NM"
"Stuft Pizza & Brewing Co., San Diego","San Diego, CA"
"Blue Mountain Barrel House, Afton","Afton, VA"
"Rockyard American Grill & Brewing Co., Castle Rock","Castle Rock, CO"
"Leinenkugel Brewing, Phoenix","Phoenix, AZ"
"Iron Hill Brewery, Media","Media, PA"
"Vino's Pizza Pub, Little Rock","Little Rock, AR"
"DC Brau Brewing Co., Washington","Washington, DC"
"Broken Compass Brewing, Breckenridge","Breckenridge, CO"
"Figueroa Mountain Brewing, Santa Barbara","Santa Barbara, CA"
"H.C. Berger Brewing, Fort Collins","Fort Collins, CO"
"Bottle Logic Brewing, Anaheim","Anaheim, CA"
"Equinox Brewing, Fort Collins","Fort Collins, CO"
"Dornbusch Brewing Co., Ipswich","Ipswich, MA"
"Four Seasons Brewing Co., Latrobe","Latrobe, PA"
"Voodoo Brewery, Meadville","Meadville, PA"
"Frederick Brewing Company, Frederick","Frederick, MD"
"Pabst Brewing, Fogelsville","Fogelsville, PA"
"Brew Moon, Needham","Needham, MA"
"Fredericksburg Brewing, Fredericksburg","Fredericksburg, TX"
"Sacramento Brewing Co., Sacramento","Sacramento, CA"
"Marin Brewing, Larkspur","Larkspur, CA"
"John Harvard's Brew House, Boston","Boston, MA"
"T-Bonz Homegrown Ales, Myrtle Beach","Myrtle Beach, SC"
"RAM Restaurant, Indianapolis","Indianapolis, IN"
"Red Star Brewery, Greensburg","Greensburg, PA"
"Cambridge Brewing, Torrington","Torrington, CT"
"Coast Brewing, Biloxi","Biloxi, MS"
"Logboat Brewing Co., Columbia","Columbia, MO"
"Troegs Brewery, Harrisburg","Harrisburg, PA"
"LaConner Brewing Co., LaConner","LaConner, WA"
"Lumberyard Brewing Co., Flagstaff","Flagstaff, AZ"
"Rainier Brewing, San Antonio","San Antonio, TX"
"AleSmith Brewing, San Diego","San Diego, CA"
"Jolly Pumpkin Artisan Ales, Dexter","Dexter, MI"
"Rock Bottom, Bethseda","Bethseda, MD"
"Echo Brewing Co., Frederick","Frederick, CO"
"Wasatch Brewery, Park City","Park City, UT"
"Thunder Canyon Brewery, Tucson","Tucson, AZ"
"Thirsty Dog Brewing, Akron","Akron, OH"
"Carver Brewing, Durango","Durango, CO"
"Bent River Brewing Co., Moline","Moline, IL"
"Tröegs Brewing Co., Harrisburg","Harrisburg, PA"
"Great Divide Brewing, Denver","Denver, CO"
"McHale’s Brewhouse, Chattanooga","Chattanooga, TN"
"John Harvard's Brew House, Cambridge","Cambridge, MA"
"Speakeasy Ales & Lagers, San Francisco","San Francisco, CA"
"Stoddard's Brewhouse and Eatery, Sunnyvale","Sunnyvale, CA"
"Trumer Brauerei Berkeley, Berkeley","Berkeley, CA"
"Rock Bottom, Broomfi eld","Broomfi eld, CO"
"Wagner Brewing Company, Lodi","Lodi, NY"
"Pelican Brewing Co., Pacifi c City","Pacifi c City, OR"
"White Bluffs Brewing, Richland","Richland, WA"
"Big Bear Brewing Company, Coral Springs","Coral Springs, FL"
"Boulder Beer Co., Boulder","Boulder, CO"
"Iron Hill Brewery, Wilmington","Wilmington, DE"
"Wiley Roots Brewing Co., Greeley","Greeley, CO"
"Olde Auburn Ale House, Auburn","Auburn, AL"
"Jailbreak Brewing Co., Laurel","Laurel, MD"
"Commonwealth Brewing, New York","New York, NY"
"SanTan Brewing Co., Chandler","Chandler, AZ"
"Left Coast Brewing Co., San Clemente","San Clemente, CA"
"Morgan Street Brewery, St. Louis","St. Louis, MO"
"Kannah Creek Brewing Co., Grand Junction","Grand Junction, CO"
"Oskar Blues, Lyons","Lyons, CO"
"Sleeping Lady Brewing Company, Anchorage","Anchorage, AK"
"Big Island Brewhaus, Kamuela","Kamuela, HI"
"Blue Point Brewing Co., Patchogue","Patchogue, NY"
"Steamworks Brewing, Durango","Durango, CO"
"BJ's Restaurant & Brewery, Portland","Portland, OR"
"Alcatraz Brewing Co., Littleton","Littleton, CO"
"Mad Anthony Brewing, Fort Wayne","Fort Wayne, IN"
"Miller Brewing, Golden","Golden, CO"
"Reuben's Brews, Seattle","Seattle, WA"
"Lone Tree Brewing Co., Lone Tree","Lone Tree, CO"
"Big River Grille, Chattanooga","Chattanooga, TN"
"Auburn Alehouse, Auburn","Auburn, CA"
"Sycamore Brewing, Charlotte","Charlotte, NC"
"Butte Creek Brewing Co., Chico","Chico, CA"
"Pete's Place, Krebs","Krebs, OK"
"Black Bottle Brewery, Fort Collins","Fort Collins, CO"
"Steelhead Brewery, San Francisco","San Francisco, CA"
"Pig’s Eye Brewing Co., Woodbury","Woodbury, MN"
"Barley Brothers Brewery, Lake Havasu City","Lake Havasu City, AZ"
"Brew Moon, Braintree","Braintree, MA"
"Figueroa Mountain Brewing, Arroyo Grande","Arroyo Grande, CA"
"Great Basin Brewing, RenoReno","RenoReno, NV"
"Tabernash Brewing, Longmont","Longmont, CO"
"Church Brew Works, Pittsburgh","Pittsburgh, PA"
"IL Vicino Brewing Co., Albuquerque","Albuquerque, NM"
"Hardywood Park Craft Brewery, Richmond","Richmond, VA"
"Beachwood BBQ & Brewing, Long Beach","Long Beach, CA"
"Oggi’s Pizza & Brewing Co., San Clemente","San Clemente, CA"
"Issaquah Brewhouse, Issaquah","Issaquah, WA"
"Silver City Brewery, Silverdale","Silverdale, WA"
"Anheuser-Busch, Saint Louis","Saint Louis, MO"
"Paducah Beer Werks, Paducah","Paducah, KY"
"Alcatraz Brewing Co., Indianapolis","Indianapolis, IN"
"The Willoughby Brewing Co., Willoughby","Willoughby, OH"
"Brasserie Saint James, Reno","Reno, NV"
"Basil T's Brewery & Italian Grill, Red Bank","Red Bank, NJ"
"Widmer Brothers Brewing, Portland","Portland, OR"
"The Beer Co., San Diego","San Diego, CA"
"Barrio Brewing Co., Tucson","Tucson, AZ"
"Raleigh Brewing Co., Raleigh","Raleigh, NC"
"Second Street Brewery, Santa Fe","Santa Fe, NM"
"San Diego Brewing Co., San Diego","San Diego, CA"
"Hub City Brewery, Lubbock","Lubbock, TX"
"Discretion Brewing, Soquel","Soquel, CA"
"Grimm Brothers Brewhouse, Loveland","Loveland, CO"
"Capitol City Brewing, Arlington","Arlington, VA"
"Brew Bus Brewing, Tampa","Tampa, FL"
"Millstream Brewing, Amana","Amana, IA"
"Victory Brewing Co., Downingtown","Downingtown, PA"
"Mankato Brewery, Mankato","Mankato, MN"
"Atwater Block Brewery, Detroit","Detroit, MI"
"Station 26 Brewing Co., Denver","Denver, CO"
"Sweetwater Brewing, Centreville","Centreville, VA"
"Aiken Brewing, Aiken","Aiken, SC"
"Jacob Leinenkugel Brewing, Chippewa Falls","Chippewa Falls, WI"
"Pabst Brewing, San Antonio","San Antonio, TX"
"Firestone Walker, Buellton","Buellton, CA"
"Big Buck Brewery and Steakhouse, Auburn Hills","Auburn Hills, MI"
"Carson’s Brewery, Evansville","Evansville, IN"
"Sound Brewery, Poulsbo","Poulsbo, WA"
"Hook & Ladder Brewing Company, Oakland","Oakland, CA"
"Kansas City Bier Co., Kansas City","Kansas City, MO"
"Pump House Restaurant & Brewery, Longmont","Longmont, CO"
"Pony Express Brewing, Olathe","Olathe, KS"
"Motorworks Brewing, Bradenton","Bradenton, FL"
"Water Street Brewery, Milwaukee","Milwaukee, WI"
"Comrade Brewing Co., Denver","Denver, CO"
"The Cowboy Restaurant & Brewery, Scottsdale","Scottsdale, AZ"
"Bent Paddle Brewing Co., Duluth","Duluth, MN"
"Upslope Brewing Co., Boulder","Boulder, CO"
"Kinetic Brewing Co., Lancaster","Lancaster, CA"
"The Tap Beer Co., Bloomington","Bloomington, IN"
"The Fort Collins Brewery, Fort Collins","Fort Collins, CO"
"Titanic Brewing, Coral Gables","Coral Gables, FL"
"Heileman Brewing Company, San Antonio","San Antonio, TX"
"Big Sky Brewing Co., Missoula","Missoula, MT"
"Central Coast Brewing Co., San Luis Obispo","San Luis Obispo, CA"
"The Powerhouse Brewing Co., Sebastopol","Sebastopol, CA"
"Drake’s Brewing Co., San Leandro","San Leandro, CA"
"John Harvard's Brew House, Braintree","Braintree, MA"
"Saint Arnold Brewing, Houston","Houston, TX"
"Piney River Brewing Co., Bucyrus","Bucyrus, MO"
"Blue Mountain Barrel House, Arrington","Arrington, VA"
"Uncle Billy’s Brew & Que, Lake TravisAustin","Lake TravisAustin, TX"
"Calhoun's Restaurant, Knoxville","Knoxville, TN"
"Brasserie Monx Ltd., Seattle","Seattle, WA"
"Great Lakes Brewing, Cleveland","Cleveland, OH"
"Back Bay Brewing Company, Boston","Boston, MA"
"Green Flash Brewing Co., San Diego","San Diego, CA"
"Crabtree Brewing Co., Greeley","Greeley, CO"
"Sly Fox Brewhouse, Royersford","Royersford, PA"
"Mystery Brewing Co., Hillsborough","Hillsborough, NC"
