brewery,city_state
"Rocky River Brewing, Sevierville","Sevierville, TN"
"Local Color Brewing Company, Novi","Novi, MI"
"Craft Brew Alliance - Kona Brewery, Kailua Kona","Kailua Kona, HI"
"Alltech’s Lexington Brewing Co., Lexington","Lexington, KY"
"Hyde Park Brewing Co., Hyde Park","Hyde Park, NY"
"Laughing Dog Brewing, Ponderay","Ponderay, ID"
"Susquehanna Brewing Co., Pittston","Pittston, PA"
"McKenzie Brew House, Glen Mills","Glen Mills, PA"
"FATE Brewing Co., Boulder","Boulder, CO"
"Pisgah Brewing Co., Black Mountain","Black Mountain, NC"
"Surly Brewing Co., Brooklyn Center","Brooklyn Center, MN"
"Pyramid Breweries, Seattle","Seattle, WA"
"Sudwerk Privatbrauerei Hübsch, Davis","Davis, CA"
"Stevens Point Brewery, Stevens Point","Stevens Point, WI"
"Carolina Brewery, Pittsboro","Pittsboro, NC"
"Harpoon Brewery, Boston","Boston, MA"
"Liberty Street Brewing Company, Akron","Akron, OH"
"P.H. Woods Restaurant, Moreno Valley","Moreno Valley, CA"
"Cannonball Creek Brewing Co., Golden","Golden, CO"
"Gordon Biersch Brewery, San Jose","San Jose, CA"
"Three Needs, Burlington","Burlington, VT"
"Chuckanut Brewery, Bellingham","Bellingham, WA"
"Sprecher Brewing, Glendale","Glendale, WI"
"Lager Heads Brewing Co., Medina","Medina, OH"
"Rock Bottom, Scottsdale","Scottsdale, AZ"
"Upland Brewing, Bloomington","Bloomington, IN"
"Rip Current Brewery, San Marcos","San Marcos, CA"
"The Spoetzl Brewery, Shiner","Shiner, TX"
"Three Brothers Brewing, Harrisonburg","Harrisonburg, VA"
"Ska Brewing, Durango","Durango, CO"
"Creature Comforts Brewing Co., Athens","Athens, GA"
"Empire Brewing Company of Rochester, Rochester","Rochester, NY"
"Barley Island Brewing Co., Noblesville","Noblesville, IN"
"Rubicon Brewing Co., Sacramento","Sacramento, CA"
"Boston Beer Co., Boston","Boston, MA"
"CB & Potts Restaurant & Brewery, Broomfield","Broomfield, CO"
"Market Garden Brewery, Cleveland","Cleveland, OH"
"LowDown Brewery + Kitchen, Denver","Denver, CO"
"Coronado Brewing Company Brewpub, Coronado","Coronado, CA"
"Triumph Brewing, Philadelphia","Philadelphia, PA"
"Madison River Brewing Co., Belgrade","Belgrade, MT"
"LoneRider Brewing Co., Raleigh","Raleigh, NC"
"Anheuser-Busch, St. Louis","St. Louis, MI"
"Big Horn Brewing, Dallas","Dallas, TX"
"The Unlikely Cowboy Restaurant & Brewery, Scottsdale","Scottsdale, AZ"
"Colorado Boy Pub & Brewery, Ridgway","Ridgway, CO"
"Redfish New Orleans Brewhouse, Boulder","Boulder, CO"
"DuClaw Brewing Co., Rosedale","Rosedale, MD"
"Nexus Brewery, Albuquerque","Albuquerque, NM"
"Narragansett Brewing Co., Providence","Providence, RI"
"Lion Bridge Brewing Co., Cedar Rapids","Cedar Rapids, IA"
"Titletown Brewing Co., Green Bay","Green Bay, WI"
"No-Li Brewhouse, Spokane","Spokane, WA"
"Block 15, Corvallis","Corvallis, OR"
"Moosejaw Pizza and Brewing, Wisconsin Dells","Wisconsin Dells, WI"
"Miller Brewing, Milwaukee","Milwaukee, WI"
"Cottonwood Brewery, Boone","Boone, NC"
"Avery Brewing, Boulder","Boulder, CO"
"Emmett’s Brewing Co., West Dundee","West Dundee, IL"
"Draught Works, Missoula","Missoula, MT"
"CJ's Brewery & Grill, La Jolla","La Jolla, CA"
"Captain Lawrence Brewing, Elmsford","Elmsford, NY"
"Ham’s Restaurant & Brewhouse, Greenville","Greenville, NC"
"Harmon Restaurant & Brewery, Tacoma","Tacoma, WA"
"choc Beer Co., Krebs","Krebs, OK"
"Thirsty Planet Brewing, Austin","Austin, TX"
"Big Horn Brewing, Wheeling","Wheeling, IL"
"Arcadia Brewing Co., Battle Creek","Battle Creek, MI"
"Oakshire Brewing, Eugene","Eugene, OR"
"Springfi eld Brewing Co., Springfi eld","Springfi eld, MO"
"Rock Bottom, King of Prussia","King of Prussia, PA"
"Lost Rhino Brewing Co., Ashburn","Ashburn, VA"
"Augusta Brewing Co., Washington","Washington, MO"
"Choc Beer Co., Krebs","Krebs, OK"
"BJ's Restaurant & Brewery, Temple","Temple, TX"
"Bitter Creek Brewing, Rock Springs","Rock Springs, WY"
"Harmon Pub & Brewery, Tacoma","Tacoma, WA"
"Main Street Brewery Lamppost Pizza, Corona","Corona, CA"
"Red Lodge Ales, Red Lodge","Red Lodge, MT"
"Rock Bottom, Portland","Portland, OR"
"Stoudts Brewing Co., Adamstown","Adamstown, PA"
"Mad Anthony Brewing, Ft. Wayne","Ft. Wayne, IN"
"Backcountry Brewery, Frisco","Frisco, CO"
"McKenzie Brew House, Malvern","Malvern, PA"
"Trout Brook Brewing Company, Hartford","Hartford, CT"
"Yak and Yeti Brewpub, Arvada","Arvada, CO"
"Redhook Brewery, Woodinville","Woodinville, WA"
"Pizza Port, Carlsbad","Carlsbad, CA"
"Bill's Tavern & Brewhouse, Cannon Beach","Cannon Beach, OR"
"West Brothers Brewery, Eugene","Eugene, OR"
"Triple C Brewing, Charlotte","Charlotte, NC"
"Boscos Brewing, Little Rock","Little Rock, AR"
"SLO Brewing, Paso Robles","Paso Robles, CA"
"Dry Dock Brewing, South Dock","South Dock, "
"The Brooklyn Brewery, Brooklyn","Brooklyn, NY"
"Kuhnhenn Brewing Co., Warren","Warren, MI"
"Elysian Brewery, Seattle","Seattle, WA"
"Ninkasi Brewing Co., Eugene","Eugene, OR"
"Pig's Eye Brewing Co., St. Paul","St. Paul, MN"
"Bootlegger’s Brewery, Fullerton","Fullerton, CA"
"Cleveland ChopHouse and Brewery, Cleveland","Cleveland, OH"
"Campbell Brewing Co., Campbell","Campbell, CA"
"Henry Weinhard's Brewing, Milwaukee","Milwaukee, WI"
"Buckhead Brewery & Grill, Stockbridge","Stockbridge, GA"
"Aspen Brewing Co., Aspen","Aspen, CO"
"Crooked Stave Artisan Beer Project, Denver","Denver, CO"
"Sandlot Brewery, Denver","Denver, CO"
"7th Settlement Brewery, Dover","Dover, NH"
"Thomas Creek Brewery, Greenville","Greenville, SC"
"Namaste Brewing at the Whip In, Austin","Austin, TX"
"Hops Restaurant Bar and Brewery, Tampa","Tampa, FL"
"West Bros Brewery, Eugene","Eugene, OR"
"Great Dane Pub, Madison","Madison, WI"
"Crossroads Brewing Co., Athens","Athens, NY"
"FireHouse Grill & Brewery, Sunnyvale","Sunnyvale, CA"
"Cedar Creek Brewery, Seven Points","Seven Points, TX"
"Schooner's Grille & Brewery, Antioch","Antioch, CA"
"Rock Bottom, Orland Park","Orland Park, IL"
"BrickStone Brewery, Bourbonnais","Bourbonnais, IL"
"Jack’s Abby Brewing, Framingham","Framingham, MA"
"Main Street Station 777 Brewpub, Las Vegas","Las Vegas, NV"
"Wicked Weed Brewing, Candler","Candler, NC"
"Black Market Brewing Co., Temecula","Temecula, CA"
"Big Horn Brewing, Westminster","Westminster, CO"
"Smuggler's Brewpub, Telluride","Telluride, CO"
"Lavery Brewing Co., Erie","Erie, PA"
"Vintage Brewing Co., Madison","Madison, WI"
